[{"id":"book:00251","title":"渝拉里斯斯星","author":"斯坦尼斯瓦夫·莱姆","country":"波兰","type":"科幻小说","year":1961,"rating":5,"date":"2022-11-06","synopsis":"书名疑为《索拉里斯星》OCR误识。波兰科幻名作：心理学家凯尔文前往被胶质海洋覆盖的索拉里斯星考察，遭遇由海洋实体化的逝去亲人，引发对人类认知与沟通极限的哲思。","locations":[{"kind":"country","place":"波兰","lng":21.01,"lat":52.23,"confidence":0.45}]},{"id":"book:00252","title":"我等待来曙山歌","author":"钟永丰","country":"中国台湾","type":"随笔","year":2015,"rating":5,"date":"2022-11-02","synopsis":"书名疑为《我等就来唱山歌》OCR误识。台湾客家词人钟永丰的随笔集，收录回忆性散文二十余篇，记述个人成长、客家文化源流、金曲奖同名专辑创作及对现代化进程的反思。","locations":[{"kind":"country","place":"中国台湾","lng":121.56,"lat":25.03,"confidence":0.45}]},{"id":"book:00253","title":"去吧，摩西","author":"威廉·福克纳","country":"美国","type":"长篇小说","year":1942,"rating":5,"date":"2022-10-29","synopsis":"福克纳约克纳帕塔法世系的重要作品，由两个中篇与五个短篇构成，围绕麦卡斯林家族数代白人与黑人的血缘纠葛，从多角度审视种族、人与自然之间复杂变动的关系。","locations":[{"kind":"country","place":"美国","lng":-73.97,"lat":40.78,"confidence":0.45}]},{"id":"book:00254","title":"八月之光","author":"威廉·福克纳","country":"美国","type":"长篇小说","year":1932,"rating":5,"date":"2022-10-29","synopsis":"福克纳的代表长篇。两条线索交织：身份成谜、被疑为黑白混血的克里斯默斯走向毁灭，与怀孕被弃的乡村姑娘莉娜徒步寻找情人，展现美国南方的种族、命运与人性图景。","locations":[{"kind":"country","place":"美国","lng":-73.97,"lat":40.78,"confidence":0.45}]},{"id":"book:00255","title":"我所留之际","author":"威廉·福克纳","country":"美国","type":"长篇小说","year":1930,"rating":5,"date":"2022-10-29","synopsis":"书名疑为《我弥留之际》OCR误识。福克纳的意识流名作，由五十九节内心独白构成，多视角讲述美国南方本德伦一家历经磨难、运送母亲遗体回乡安葬的苦难历程。","locations":[{"kind":"country","place":"美国","lng":-73.97,"lat":40.78,"confidence":0.45}]},{"id":"book:00256","title":"我弥留之际","author":"威廉·福克纳 (William Faulkner)","country":"美国","type":"长篇小说","year":1930,"rating":5,"date":"2022-10-23","synopsis":"美国南方一户贫农家庭的母亲去世后，全家依其遗愿运送遗体回故乡安葬，一路涉水穿火、波折不断。小说以十余位人物的内心独白交替叙述，呈现意识流的多声部结构。","locations":[{"kind":"country","place":"美国","lng":-73.97,"lat":40.78,"confidence":0.45}]},{"id":"book:00257","title":"暗哗与骚动","author":"威廉·福克纳","country":"美国","type":"长篇小说","year":1929,"rating":5,"date":"2022-10-22","synopsis":"书名出自《麦克白》。以意识流手法，通过康普生家三个儿子及黑人女佣四个视角，反复讲述美国南方没落地主家庭的衰败与一家人的命运。","locations":[{"kind":"country","place":"美国","lng":-73.97,"lat":40.78,"confidence":0.45}]},{"id":"book:00258","title":"你一生的故事","author":"特德·姜","country":"美国","type":"短篇小说集","year":2002,"rating":5,"date":"2022-10-16","synopsis":"特德·姜的中短篇科幻小说集（原名《你一生的故事及其他》），收录《巴比伦塔》《你一生的故事》等多篇，以语言、数学、宗教等命题展开思辨性科幻想象。","locations":[{"kind":"country","place":"美国","lng":-73.97,"lat":40.78,"confidence":0.45}]},{"id":"book:00259","title":"呼吸","author":"特德·姜","country":"美国","type":"短篇小说集","year":2019,"rating":5,"date":"2022-10-16","synopsis":"特德·姜第二部中短篇科幻小说集，收录《商人和炼金术士之门》《呼吸》《软件体的生命周期》等九篇，探讨时间、自由意志、人工智能与存在等命题。","locations":[{"kind":"country","place":"美国","lng":-73.97,"lat":40.78,"confidence":0.45}]},{"id":"book:00260","title":"仿生人会梦见电子羊吗?","author":"菲利普·迪克","country":"美国","type":"科幻小说","year":1968,"rating":4,"date":"2022-10-07","synopsis":"核战后的末世地球，赏金猎人里克·德卡德追杀逃亡的仿生人，过程中不断追问人与机器、真实与拟造的界限。电影《银翼杀手》原著。","locations":[{"kind":"country","place":"美国","lng":-73.97,"lat":40.78,"confidence":0.45}]},{"id":"book:00261","title":"九重葛与美少年","author":"李渝","country":"中国台湾","type":"短篇小说集","year":2013,"rating":5,"date":"2022-09-29","synopsis":"台湾作家李渝的短篇小说集，收录《待鹤》《九重葛与美少年》《夜渡》等多篇，跨越作者数十年创作，书写受困现实之人在想象、自然、艺术中走向救赎。","locations":[{"kind":"country","place":"中国台湾","lng":121.56,"lat":25.03,"confidence":0.45}]},{"id":"book:00262","title":"押沙龙，押沙龙！","author":"威廉·福克纳","country":"美国","type":"长篇小说","year":1936,"rating":5,"date":"2022-09-25","synopsis":"以约克纳帕塔法县萨德本家族自1860年至1910年的兴衰为线索，通过多人叙述与回忆拼接，呈现美国南方的种族、家族与命运纠葛的哥特式悲剧。","locations":[{"kind":"country","place":"美国","lng":-73.97,"lat":40.78,"confidence":0.45}]},{"id":"book:00263","title":"鱼王","author":"维克托·阿斯塔菲耶夫","country":"苏联","type":"长篇小说","year":1976,"rating":5,"date":"2022-09-18","synopsis":"由十三篇相对独立的作品连缀而成，以西伯利亚原野、河流为背景，描写当地人与自然的复杂关系，思考人对自然的索取与敬畏。","locations":[{"kind":"country","place":"苏联","lng":37.62,"lat":55.75,"confidence":0.45}]},{"id":"book:00264","title":"苦炼","author":"玛格丽特·尤瑟纳尔","country":"法国","type":"长篇小说","year":1968,"rating":5,"date":"2022-09-08","synopsis":"以16世纪文艺复兴时期欧洲为背景，讲述虚构人物、医生兼炼金术士泽农一生的求知、漂泊与精神探索，呈现思想者在宗教与权力夹缝中的命运。获费米娜奖。","locations":[{"kind":"country","place":"法国","lng":2.35,"lat":48.85,"confidence":0.45}]},{"id":"book:00265","title":"塔鱼浜自然史","author":"邹汉明","country":"中国大陆","type":"散文","year":2021,"rating":4,"date":"2022-09-05","synopsis":"作者以童年记忆回望江南一座已于2009年拆迁消失的自然村塔鱼浜，从地理、节令、动植物与农事等多个维度，重建这座村庄的日常生活与精神面貌，是一部乡村的文学自然史。","locations":[{"kind":"country","place":"中国大陆","lng":116.4,"lat":39.9,"confidence":0.45}]},{"id":"book:00266","title":"白鹭在冰面上站着","author":"雷平阳","country":"中国大陆","type":"散文","year":2020,"rating":5,"date":"2022-09-04","synopsis":"云南诗人雷平阳的散文集，以诗性笔触书写云南的山河地理与人间众生，将江河群山与小人物的困顿、坚韧交织，在荒寒与苦难中透出微光与希望。","locations":[{"kind":"country","place":"中国大陆","lng":116.4,"lat":39.9,"confidence":0.45}]},{"id":"book:00267","title":"达洛维夫人","author":"弗吉尼亚·伍尔夫 (Virginia Woolf)","country":"英国","type":"长篇小说","year":1925,"rating":5,"date":"2022-09-02","synopsis":"一战后的伦敦，上流社会女主人克拉丽莎·达洛维为一场晚宴奔忙的一天。小说以意识流手法穿梭于她与退伍军人等人物的回忆与心绪之间，于一日之内铺展人物的一生。","locations":[{"kind":"country","place":"英国","lng":-0.12,"lat":51.51,"confidence":0.45}]},{"id":"book:00268","title":"假装在西贡","author":"王梆","country":"中国大陆","type":"短篇小说集","year":2022,"rating":5,"date":"2022-08-28","synopsis":"旅英作家王梆首部小说集，收录十个短篇，书写不同时空中女性的孤独、爱与倔强，人物穿行于南方故土、英伦异乡与未来废墟之间。","locations":[{"kind":"country","place":"中国大陆","lng":116.4,"lat":39.9,"confidence":0.45}]},{"id":"book:00269","title":"刀锋藏身","author":"徐皓峰","country":"中国大陆","type":"短篇小说集","year":2013,"rating":5,"date":"2022-08-21","synopsis":"徐皓峰武侠短篇小说集（书名应为《刀背藏身》），收录《师父》《国士》《刀背藏身》等六篇，淡化招式、重写练武人的心态与人生处境。","locations":[{"kind":"country","place":"中国大陆","lng":116.4,"lat":39.9,"confidence":0.45}]},{"id":"book:00270","title":"米格尔街","author":"V.S.奈保尔","country":"英国","type":"短篇小说集","year":1959,"rating":4,"date":"2022-08-21","synopsis":"诺奖作家奈保尔首部短篇小说集，以特立尼达首都西班牙港一条名为米格尔街的小街为舞台，由十七个相互勾连的短篇描绘街区底层小人物的悲喜日常。","locations":[{"kind":"country","place":"英国","lng":-0.12,"lat":51.51,"confidence":0.45}]},{"id":"book:00271","title":"石秀","author":"施蛰存","country":"中国大陆","type":"短篇小说","year":1932,"rating":4,"date":"2022-08-15","synopsis":"取材自《水浒传》中石秀、杨雄杀潘巧云一段，作者借弗洛伊德精神分析学说重构故事，细致剖析石秀潜意识中情欲与暴力交织的畸形心理，是中国现代心理分析历史小说的代表作。","locations":[{"kind":"country","place":"中国大陆","lng":116.4,"lat":39.9,"confidence":0.45}]},{"id":"book:00272","title":"仙症","author":"郑执","country":"中国大陆","type":"短篇小说集","year":2020,"rating":4,"date":"2022-08-15","synopsis":"短篇小说集，收录《仙症》《蒙地卡罗食人记》《森中有林》等六篇。以沈阳等东北城市为背景，把魔幻、侦探元素与日常生活杂糅，用口语化、幽默的笔调书写小人物的命运与精神困境。","locations":[{"kind":"country","place":"中国大陆","lng":116.4,"lat":39.9,"confidence":0.45}]},{"id":"book:00273","title":"尤瑟娜","author":"玛格丽特·尤瑟纳尔 (Marguerite Yourcenar)","country":"法国","type":"","year":null,"rating":5,"date":"2022-08-14","synopsis":"","locations":[{"kind":"country","place":"法国","lng":2.35,"lat":48.85,"confidence":0.45}]},{"id":"book:00274","title":"额尔古纳河右岸","author":"迟子建","country":"中国大陆","type":"长篇小说","year":2005,"rating":4,"date":"2022-08-13","synopsis":"以东北鄂温克族最后一位女酋长的口吻，讲述这一以驯鹿为生的游猎民族在大兴安岭森林中百年的迁徙、生息与变迁，展现一个家族数代人的命运及人与自然的关系。获第七届茅盾文学奖。","locations":[{"kind":"country","place":"中国大陆","lng":116.4,"lat":39.9,"confidence":0.45}]},{"id":"book:00275","title":"族长的秋天","author":"加西亚·马尔克斯","country":"哥伦比亚","type":"长篇小说","year":1975,"rating":5,"date":"2022-08-09","synopsis":"运用繁复意象与绵长句式，描绘一位加勒比独裁者漫长而孤独的一生：他大权独揽、享尽荣光，却始终无法摆脱孤独与无力去爱的命运，是对独裁与孤独主题的极致书写。","locations":[{"kind":"country","place":"哥伦比亚","lng":-74.07,"lat":4.71,"confidence":0.45}]},{"id":"book:00276","title":"梦中的欢快群礼和十二个异乡故事","author":"加西亚·马尔克斯","country":"哥伦比亚","type":"短篇小说集","year":1992,"rating":5,"date":"2022-08-06","synopsis":"短篇小说集，收录十二个故事，写漂泊于欧洲的拉丁美洲人在异乡的离奇遭遇与命运，包含《睡美人航班》《圣女》《光恰似水》等，基调奇诡、忧伤而富有魔幻色彩。","locations":[{"kind":"country","place":"哥伦比亚","lng":-74.07,"lat":4.71,"confidence":0.45}]},{"id":"book:00277","title":"奥兰多","author":"弗吉尼亚·伍尔夫","country":"英国","type":"长篇小说","year":1928,"rating":5,"date":"2022-08-03","synopsis":"半自传体幻想小说。主人公奥兰多是一名永生者，从十六世纪活到二十世纪，并中途由男性变为女性，借其跨越数百年的经历探讨性别、时间与人的身份，被视为献给薇塔的长篇情书。","locations":[{"kind":"country","place":"英国","lng":-0.12,"lat":51.51,"confidence":0.45}]},{"id":"book:00278","title":"金鸡","author":"胡安·鲁尔福","country":"墨西哥","type":"中短篇小说","year":1980,"rating":5,"date":"2022-07-30","synopsis":"讲述穷困的迪奥尼西奥·宾松救下一只濒死的金鸡后，靠斗鸡逆转人生，并与一位女歌手结伴走南闯北、四处赌斗，最终仍逃不脱命运的安排。原为电影脚本，文本于1980年首次出版。","locations":[{"kind":"country","place":"墨西哥","lng":-99.13,"lat":19.43,"confidence":0.45}]},{"id":"book:00279","title":"少年巴比伦","author":"路内","country":"中国大陆","type":"长篇小说","year":2008,"rating":5,"date":"2022-07-29","synopsis":"「追随三部曲」之一。1990年代的戴城，青年路小路在化工厂当工人，浑噩度日，与厂医白蓝相恋，后因白蓝考研离去而分别。以幽默自嘲的语调写工厂底层青年的青春、爱情与时代。","locations":[{"kind":"country","place":"中国大陆","lng":116.4,"lat":39.9,"confidence":0.45}]},{"id":"book:00280","title":"花телей往事","author":"路内","country":"中国大陆","type":"长篇小说","year":2013,"rating":5,"date":"2022-07-29","synopsis":"以1970至1980年代的小城蔷薇街为背景，围绕国营照相馆摄影师顾大宏一家及街坊邻里展开，借舞会、冲突与家庭变迁，描摹时代变动下小人物的命运与一条街道的旧时光。","locations":[{"kind":"country","place":"中国大陆","lng":116.4,"lat":39.9,"confidence":0.45}]},{"id":"book:00281","title":"台北人","author":"白先勇","country":"中国台湾","type":"短篇小说集","year":1971,"rating":5,"date":"2022-07-29","synopsis":"由十四个短篇结集而成，写1949年前后从大陆迁台的各色人物及其在台北的生活，借今昔对照流露今不如昔的苍凉，包含《永远的尹雪艳》《金大班的最后一夜》等，是华语文学经典。","locations":[{"kind":"country","place":"中国台湾","lng":121.56,"lat":25.03,"confidence":0.45}]},{"id":"book:00282","title":"白鲸","author":"赫尔曼·麦尔维尔","country":"美国","type":"长篇小说","year":1851,"rating":5,"date":"2022-07-29","synopsis":"以水手以实玛利的视角，讲述捕鲸船裴廓德号船长亚哈为报断腿之仇，疯狂追捕白色巨鲸莫比·迪克，终至船毁人亡的故事，被视为美国文学史上最伟大的史诗小说之一。","locations":[{"kind":"country","place":"美国","lng":-73.97,"lat":40.78,"confidence":0.45}]},{"id":"book:00283","title":"燃烧的原野","author":"胡安·鲁尔福","country":"墨西哥","type":"短篇小说集","year":1953,"rating":5,"date":"2022-07-29","synopsis":"短篇小说集，收十七个故事，写墨西哥乡间最贫苦的农民、赶牲口者、逃债者等人的生存境况，以冷峻、简练的笔触呈现乡村的暴力、贫穷与宿命，是墨西哥现代文学的开创性作品。","locations":[{"kind":"country","place":"墨西哥","lng":-99.13,"lat":19.43,"confidence":0.45}]},{"id":"book:00284